production_id	level	changed	split	sentence_text_from	sentence_text_to
80	ORI->STR	S	N	Segundo um vendedor que não quis se identificar, são comercializadas cerca de 40 unidades por dia.	Um vendedor que não quis se identificar afirmou que são vendidas cerca de 40 unidades por dia.
81	ORI->STR	S	N	Essas amostras poderão conter, também, sinais de formas de vida que sobrevivem em temperaturas elevadas.	Essas pequenas porções também poderão conter sinais de formas de vida que sobrevivem em temperaturas elevadas.
83	ORI->STR	S	N	Passou a não se preocupar apenas em frear a inflação, mas também em manter o ritmo de crescimento econômico.	Passou a não se preocupar apenas em diminuir a inflação, como também em manter o ritmo de crescimento econômico.
83	ORI->STR	S	N	Vários especialistas acreditam que o banco central americano voltará a agir, dessa vez para reduzir a taxa básica, caso o nervosismo dos investidores predomine nos próximos dias.	Caso o nervosismo dos investidores apareça mais intenso nos próximos dias, vários especialistas acreditam que o banco central americano voltará a agir, dessa vez com o objetivo de reduzir a taxa básica.
85	ORI->STR	S	N	Dali, seguiria para o Mercado Público, passaria por baixo da Hercílio Luz e, pela Avenida Beira-Mar Norte, iria até a Universidade Federal de Santa Catarina (UFSC).	Dali, seguiria para o Mercado Público, passaria por baixo da Hercílio Luz e iria até a UFSC pela Avenida Beira-Mar Norte.
86	ORI->STR	S	N	Em casos de diarréia e vômitos, é aconselhado que os pais levem os filhos aos postos para serem avaliados por um médico sobre a possibilidade de se vacinar.	Até mesmo crianças com febre devem tomar as gotinhas.
87	ORI->STR	S	N	Ou seja, lá vem a saraivada de pedidos para o Dia das Crianças.	Isto é, lá vem a grande quantidade de pedidos para o Dia das Crianças.
87	ORI->STR	S	N	Portanto, jogos eletrônicos, robôs e bonecas falantes, sem a interatividade de quem os manuseia, não garantem a felicidade de ninguém.	Com isso, jogos eletrônicos, robôs e bonecas falantes, sem a participação da pessoa que os manuseia, não garantem a felicidade de ninguém.
87	ORI->STR	S	N	-- A ação de brincar converte um cabo de vassoura em um cavalo, uma tampa de panela em volante de automóvel, uma caneta em microfone e os lençóis em barracas e castelos -- ressalta.	-- Brincar transforma um cabo de vassoura em um cavalo, uma tampa de panela em volante de automóvel, uma caneta em microfone e os lençóis em barracas e castelos -- destaca.
87	ORI->STR	S	N	Com brinquedos artesanais (ao lado vão quatro dicas), o aprendizado é duplo.	O aprendizado é duplo com brinquedos feitos a mão.
87	ORI->STR	S	N	Os pais percebem, ao lado dos filhos, a importância do reaproveitamento de coisas que perderam a utilidade original.	Os pais percebem a importância de utilizar novamente coisas que perderam a utilidade original.
90	ORI->STR	S	N	Apartir daí, o sistema automático faz o resto.	A partir de aí, o sistema automático faz o resto.
90	ORI->STR	S	N	E basta uma pequena assimetria entre eles para que o sistema automático se desarme e o avião volte para o modo manual.	Basta uma pequena diferença entre eles para que o sistema automático se desarme e o avião volte para o modo manual.
94	ORI->STR	S	N	A comunidade conseguiu que a Câmara local transformasse a região em Área de Preservação Ambiental (APA), em lei aprovada em junho de 2005.	A comunidade conseguiu que a Câmara local transformasse a região em Área de Preservação Ambiental, em lei de junho de 2005.
96	ORI->STR	S	N	Foi no Brasil que Kerry conheceu Tereza, sua mulher.	Kerry conheceu sua mulher Tereza no Brasil.
96	ORI->STR	S	N	Perguntado se o protocolo de Kyoto será ratificado no caso da eleição de um democrata para a presidência em 2008, Kerry surpreendeu.	Kerry surpreendeu no momento em que lhe perguntaram se o protocolo de Kyoto será confirmado no caso da eleição de um democrata para a presidência em 2008.
97	ORI->STR	S	N	Para a merenda escolar, é elaborado um cardápio padrão.	Prepara-se um cardápio padrão para a merenda escolar.
99	ORI->STR	S	N	A redução na alíquota do Imposto sobre Circulação de Mercadorias e Serviços (ICMS) e a concorrência entre os postos derrubaram o preço da gasolina no mês passado em 41 dos 43 municípios pesquisados pela Agência Nacional do Petróleo (ANP).	A redução na alíquota do Imposto sobre Circulação de Mercadorias e Serviços (ICMS) e a competição entre os postos derrubaram o preço da gasolina no mês passado em 41 dos 43 municípios que a Agência Nacional do Petróleo (ANP) pesquisou.
99	ORI->STR	S	N	Segundo o Sindicato do Comércio Varejista de Combustíveis e Lubrificantes do Estado (Sulpetro), a redução de três pontos percentuais no tributo seria responsável por um recuo de até R$ 0,11 no preço de bomba, caso o álcool anidro não tivesse sido reajustado em 13% no final do ano passado.	O Sindicato do Comércio Varejista de Combustíveis e Lubrificantes do Estado (Sulpetro) diz que, se não tivessem aumentado o álcool anidro em 13% no final do ano passado, a redução de três por cento no tributo seria responsável por uma redução de até R$ 0,11 no preço de bomba.
99	ORI->STR	S	N	R$ 2,486. O município é seguido de perto por Canoas e Porto Alegre, segundo dados coletados pela ANP na pesquisa feita entre os dias 29 e 31 do mês passado.	Canoas e Porto Alegre seguem de perto o município, de acordo com dados que a ANP coletou na pesquisa que fez entre os dias 29 e 31 do mês passado.
99	ORI->STR	S	N	Oliveira avaliou que isso deve-se ao reajuste de 13% do álcool pelas distribuidoras.	Oliveira avaliou que isso se deve ao aumento de 13% do álcool anidro pelas empresas que distribuem combustível.
100	ORI->STR	S	N	Por volta das 16h30 min, a calefação volta a ser ligada.	O aquecimento volta a ser ligado em torno das 16h30 min.
102	ORI->STR	S	N	O toque de requinte a esses aposentos austeros é conferido por flores.	Flores dão o toque de elegância a esse apartamento sem enfeites.
102	ORI->STR	S	N	Fora dali, também está tudo pronto.	Tudo está pronto também fora dali.
103	ORI->STR	S	N	Uma diferença fundamental entre as duas opções é que o consórcio que for comprar só a parte doméstica precisa ter participação de uma empresa aérea.	Uma diferença fundamental entre as duas opções é que o grupo de empresas que comprar só a parte doméstica precisa incluir uma empresa aérea.
103	ORI->STR	S	N	A instituição também pode financiar em até 50% compradores interessados na Varig.	A instituição também pode emprestar até 50% do capital necessário aos compradores interessados na Varig.
106	ORI->STR	S	N	-- Queremos espaçar mais as realizações do Fórum.	-- Queremos tornar as realizações do Fórum menos freqüentes.
106	ORI->STR	S	N	É preciso debater urgentemente uma solução para isso.	É preciso discutir depressa uma solução para isso.
107	ORI->STR	S	N	A Capital vivencia um fenômeno contraditório:	A Capital vive um fenômeno sem lógica:
107	ORI->STR	S	N	O aumento da população de rua, de um lado, é acompanhado da redução dos espaços públicos historicamente usados por mendigos.	O aumento da população de rua é acompanhado da redução dos espaços públicos que os mendigos usam historicamente.
107	ORI->STR	S	N	Nesses bairros, quem no passado era afável com desabrigados hoje vive às turras com vizinhos indesejados.	Nesses bairros, quem era amável com sem-teto hoje vive brigando com vizinhos não desejados.
108	ORI->STR	S	N	Segundo historiadores, não existe um registro preciso de quando teve início a tradição da colheita da planta.	Os historiadores dizem que não existe um registro preciso do início da tradição da colheita da planta.
108	ORI->STR	S	N	-- O tempo da maturação da macela coincide com a Páscoa, daí esse fenômeno -- explica o bispo.	-- O amadurecimento da macela acontece junto com a Páscoa, daí esse fenômeno -- explica o bispo.
108	ORI->STR	S	N	Conforme a nutricionista Leila Tortelli, há duas recomendações importantes:	A nutricionista Leila Tortelli diz que há duas recomendações importantes:
108	ORI->STR	S	N	Nos dicionários, o nome da planta está como macela.	O nome da planta nos dicionários é macela.
108	ORI->STR	S	N	Para o professor de português e doutor em Letras Cláudio Moreno, deve ser seguida a orientação dos dicionários, ou seja, macela.	O professor de português e doutor em Letras Cláudio Moreno diz que se deve seguir a orientação dos dicionários, ou seja, macela.
109	ORI->STR	S	N	A área de lazer está montada para não decepcionar as crianças.	A área de lazer está preparada para não entristecer as crianças.
109	ORI->STR	S	N	Caso ocorram incidentes comuns, como o engarrafamento de camelos, não se preocupe:	Não se preocupe se acontecerem eventos comuns como engarrafamento de camelos:
111	ORI->STR	S	N	-- Pois é, pessoal, o que eu lamento contar é que depois da festa a escola foi arrombada e roubada -- disse Emília, em tom de indignação e, sobretudo, de decepção.	-- Pois é, pessoal, lamento contar que arrombaram e roubaram a escola depois da festa -- disse Emília, em tom de raiva e decepção.
111	ORI->STR	S	N	Que alguns alunos tiveram participação no caso.	Alguns alunos participaram do caso.
111	ORI->STR	S	N	O resultado é que parte do material foi recuperado com a ajuda de denúncias à polícia.	O resultado foi que recuperaram parte do material com a ajuda de denúncias à polícia.
111	ORI->STR	S	N	Nesse lar, entretanto, mais importante que fincar raízes é o apego dos irmãos entre si.	Mas, nesse lar, mais importante que fincar raízes é o afeto entre os irmãos.
112	ORI->STR	S	N	Na América Latina, o relatório afirma que a epidemia permanece estável.	O relatório afirma que a epidemia permanece sem variação na América Latina.
114	ORI->STR	S	N	A paixão pela comunicação e a obsessão pela qualidade dos produtos e serviços que oferece ao público levaram a RBS, nesse período de cinco décadas, a investir sistematicamente em tecnologia, inovação e no desenvolvimento profissional.	A paixão pela comunicação e a dedicação à qualidade dos produtos e serviços que oferece ao público levaram a RBS a investir de maneira sistemática em tecnologia, novidade e desenvolvimento profissional.
114	ORI->STR	S	N	Essa proximidade com o público, aliada à certeza de que aqui os gaúchos e catarinenses têm vez e voz para divulgar suas realizações e exercer um ato importante de cidadania, que é o de se comunicar livremente, vem assegurando à RBS uma gratificante liderança em todos os segmentos em que atua.	Essa condição de estar próxima do público e a certeza de que aqui os gaúchos e catarinenses têm vez e voz para divulgar suas realizações e exercer um ato importante de cidadania garantem à RBS a posição de líder em todos os campos em que atua.
114	ORI->STR	S	N	Em retribuição, o grupo procura oferecer informação, serviço e entretenimento compatíveis com as exigências de seus usuários.	O grupo procura agradecer oferecendo informação, serviço e diversão compatíveis com as exigências de seus usuários.
116	ORI->STR	S	N	Segundo Steiner, os telescópios Gemini têm capacidade científica de observação e qualidade de imagem dez vezes superiores às de um telescópio espacial.	Steiner diz que a capacidade científica de observação e a qualidade de imagem dos telescópios Gemini são dez vezes maiores que as de um telescópio espacial.
117	ORI->STR	S	N	O assunto deve ser debatido durante a presidência francesa da UE, no segundo semestre.	O sequenciamento de genes não pode ser limitado por patentes que pretendem proteger o direito exclusivo a esse conhecimento em nome do direito de propriedade industrial".
118	ORI->STR	S	N	Para o agrônomo, o Brasil deve buscar o desenvolvimento de transgenias que tentem melhorar as condições da agricultura local, como o cultivo de plantas com a capacidade de captar certos elementos presentes na terra.	Para o agrônomo, o Brasil deve buscar o desenvolvimento de transgenias que tentem melhorar as condições da agricultura local, como a cultura de plantas com capacidade de captar certos elementos presentes na terra.
120	ORI->STR	S	N	O Instituto Nacional de Pesquisas Espaciais (Inpe) prediz um aumento de temperatura de até 5 C nas áreas mais secas da Amazônia, em 50 anos, se a emissão de gases por queimadas permanecer nos níveis atuais.	Se a emissão de gases por queimadas permanecer nos níveis atuais, o Instituto Nacional de Pesquisas Espaciais prevê um aumento de temperatura de até 5 C nas áreas mais secas da Amazônia nos próximos 50 anos.
123	ORI->STR	S	N	Apesar do nome, Hymenoepimecis sp., o tal invasor de corpos é só uma vespa.	O tal ser que invade corpos é só a vespa Hymenoepimecis sp.
123	ORI->STR	S	N	Então, libera uma droga ainda desconhecida na corrente sanguínea da vítima.	Em seguida, libera uma droga até agora desconhecida no sangue da vítima.
123	ORI->STR	S	N	Dopada, ela passa a repetir um único padrão de teia, em vez de tecê-lo no formato circular tradicional.	O efeito da substância faz com que ela passe a repetir um único padrão de teia, em lugar de tecer no formato circular tradicional.
124	ORI->STR	S	N	Isso indica que, de alguma forma, as células-tronco da medula óssea haviam sido capazes de "colonizar" o fígado das mulheres transplantadas.	Isso indica que as células-tronco da medula óssea haviam sido capazes de se multiplicar no fígado das mulheres que sofreram transplante.
124	ORI->STR	S	N	O resultado deverá contribuir para o desenvolvimento de tecidos humanos para uso terapêutico, dizem os autores.	Os autores dizem que o resultado deverá contribuir para o desenvolvimento de tecidos humanos para uso no tratamento de doenças.
125	ORI->STR	S	N	Para realizar o cálculo, a equipe de Vörösmarty dividiu o mundo em 60 mil microrregiões.	Para realizar o cálculo, a equipe de Vörösmarty dividiu o mundo em 60 mil regiões muito pequenas.
125	ORI->STR	S	N	"Descobrimos que os recursos hídricos locais em algumas áreas estão simplesmente esgotados", afirmou.	Descobrimos que as reservas de água em algumas áreas estão simplesmente vazias".
126	ORI->STR	S	N	Isso quer dizer que os camundongos transgênicos reduziram a gordura de seu corpo, em relação à massa muscular, sem fazer ginástica.	Isso significa que os camundongos transgênicos reduziram a gordura de seu corpo sem fazer ginástica.
126	ORI->STR	S	N	Um dos caminhos seria sua superestimulação.	Um dos caminhos seria sua produção em excesso.
127	ORI->STR	S	N	"Já temos brotos de alface comprovadamente transgênicos", disse Jackson Marcondes de Souza.	"Já temos brotos de alface que, com certeza, são transgênicos com certeza", disse Jackson Marcondes de Souza.
127	ORI->STR	S	N	Sob a orientação do pesquisador Ekkehard Hansen, ele desenvolve o projeto como parte de seu doutorado.	Ele desenvolve o projeto como parte de seu doutorado, sob a orientação do pesquisador Ekkehard Hansen.
128	ORI->STR	S	N	Os números gerais da internet apontam o mesmo fenômeno, diz Ellman.	Ellman diz que os números gerais da internet apontam um fenômeno igual.
129	ORI->STR	S	N	"Ninhais que eram ocupados há 650 anos sumiram", contou David Vaughan à Folha.	David Vaughan contou à Folha que sumiu uma grande quantidade de ninhos que eram ocupados há 650 anos.
129	ORI->STR	S	N	O pesquisador, contudo, ainda não está convencido de que o vilão antártico seja o efeito estufa.	Mas o pesquisador ainda não está convencido de que o efeito estufa esteja causando as mudanças na Antártica.
130	ORI->STR	S	N	Para descobrir a razão dessa diferença, Kawaoka usou uma estratégia de "engenheirar" os vírus, trocando genes entre as linhagens virais.	Kawaoka trocou os genes entre os tipos de vírus para descobrir a razão dessa diferença.
130	ORI->STR	S	N	"Uma mudança de apenas uma base [letra] no gene PB2 [que resultou na modificação de um aminoácido na proteína por ele codificada] parece ser a causa da virulência do influenza", explica.	"Uma mudança de apenas uma base no gene PB2 parece ser a causa da capacidade do influenza de provocar doença", explica.
132	ORI->STR	S	N	Além de "morar" no halo, aparentemente, ele também "nasceu" lá, dizem os cientistas.	Os cientistas dizem que, além de "morar" em volta da galáxia, parece que ele também "nasceu" lá.
133	ORI->STR	S	N	Bem que muitos astrônomos gostariam de varrer o monte de planetas gigantes extra-solares que foram encontrados nos últimos anos para debaixo do tapete cósmico.	Muitos astrônomos gostariam de varrer para debaixo do tapete cósmico o monte de planetas extra-solares gigantes encontrados nos últimos anos.
134	ORI->STR	S	N	A riqueza de artefatos de várias origens ali depositados pelas sucessivas levas de ocupantes do território português.	A riqueza de objetos de várias origens depositados ali por grupos de pessoas que ocuparam o território português ao longo do tempo.
134	ORI->STR	S	N	"O rio Arade foi a principal rota de acesso a Silves desde a implantação dos estabelecimentos fenícios no Algarve", escrevem os três brasileiros em artigo a ser publicado na revista do MAE.	Os três brasileiros escreveram no artigo que vai ser publicado na revista do MAE que "o rio Arade foi a principal rota de acesso a Silves desde o estabelecimento dos fenícios no Algarve".
134	ORI->STR	S	N	Segundo os arqueólogos, "durante a escavação foram encontrados inúmeros fragmentos, principalmente cerâmicos, que vão desde ânforas romanas até utensílios inteiros do século 16, passando pela cerâmica árabe".	Na opinião dos arqueólogos, "durante a escavação foram encontrados muitos pedaços de cerâmica, que vão desde vasos romanos até utensílios inteiros do século 16, passando pela cerâmica árabe".
134	ORI->STR	S	N	Rambelli mostra como o principal objetivo da arqueologia, tanto em cima como embaixo d'água, é a busca de conhecimento, não de suvenires.	Rambelli mostra como o principal objetivo da arqueologia é a busca de conhecimento, não de lembranças.
134	ORI->STR	S	N	O livro também busca conscientizar os mergulhadores sobre o patrimônio subaquático.	O livro também buscar alertar os mergulhadores para a riqueza que está debaixo da água.
135	ORI->STR	S	N	Todos eles descendem de lobos domesticados pela primeira vez no leste da Ásia, há possivelmente meros 15 mil anos.	Todos eles têm origem em lobos domesticados pela primeira vez no leste da Ásia há uns poucos 15 mil anos.
135	ORI->STR	S	N	"Meros" porque esse período é muito curto em termos de evolução.	"Poucos", porque esse período é muito curto quando se fala de evolução.
135	ORI->STR	S	N	Dois estudos sobre o material genético dos cães publicados hoje na revista "Science" (www.sciencemag.org) revelaram que, diferentemente do que indicavam os achados arqueológicos, os primeiros cães domésticos surgiram no Extremo Oriente, e não no Oriente Médio.	Dois estudos sobre os genes dos cães publicados hoje na revista "Science" revelaram que os primeiros cães domésticos surgiram no Extremo Oriente e não no Oriente Médio.
135	ORI->STR	S	N	E que, apesar da sua longa permanência nas Américas, a grande maioria dos cães do continente veio mesmo da Europa depois da "descoberta" de Cristóvão Colombo, em 1492.	Os estudos revelaram que a grande maioria dos cães veio mesmo da Europa, depois de Cristóvão Colombo.
135	ORI->STR	S	N	Depois, havia diferenças que indicavam que as raças hoje comuns na América têm mais em comum com cães trazidos pelos colonos europeus.	Segunda, havia diferenças que indicavam que as raças hoje comuns na América são mais parecidas com cães que os europeus trouxeram.
135	ORI->STR	S	N	E todos esses bichos com o nome científico Canis Familiaris descendem do lobo, o Canis Lupus.	Todos os bichos com o nome científico Canis familiaris têm origem no lobo, o Canis lupus.
135	ORI->STR	S	N	A rapidez da disseminação dos cachorros com seus donos humanos indica que eles deviam ser particularmente úteis aos primitivos caçadores-coletores.	A rapidez com que os cachorros e seus donos humanos se espalharam indica que os cães deviam ser úteis aos homens primitivos.
136	ORI->STR	S	N	No ano passado, um grupo da Comissão de Energia Atômica da França havia anunciado a existência de um verdadeiro campo minado composto por centenas de milhares de buracos negros distribuídos ao redor da Via Láctea.	No ano passado, um grupo da Comissão de Energia Atômica da França anunciou a existência de um campo de centenas de milhares de buracos negros distribuídos ao redor da Via Láctea.
136	ORI->STR	S	N	E a data em que a aproximação máxima vai ocorrer também não apavora:	A data também não assusta:
136	ORI->STR	S	N	O processo faz a estrela recém-nascida liberar energia e interromper o encolhimento induzido pela força gravitacional.	O processo faz a estrela que acabou de nascer liberar energia e interromper a diminuição de tamanho que a força da gravidade provoca.
136	ORI->STR	S	N	Quando ele se esgota, a estrela, se for grande o suficiente, entra em colapso.	A estrela é destruída quando ele acaba.
136	ORI->STR	S	N	Ficando cada vez mais compacta, a estrela chega a um ponto em que a força da gravidade em sua superfície é tão grande que nem a luz, viajando a 300 mil quilômetros por segundo, é capaz de escapar dela.	Cada vez mais compacta, a estrela chega a um ponto em que a força da gravidade em sua superfície é tão grande que nem a luz é capaz de escapar dela.
136	ORI->STR	S	N	A estrela fica literalmente invisível, ganhando o nome de buraco negro.	A estrela fica invisível e ganha o nome de buraco negro.
136	ORI->STR	S	N	"Muitas vezes a matéria vai mais para um lado, dando um empurrão na estrela e tirando-a de sua órbita".	"Muitas vezes, a matéria vai mais para um lado, dando um empurrão na estrela e tirando-a de sua órbita".
138	ORI->STR	S	N	Com a pessoa sozinha, acompanhada do cônjuge, acompanhada do animal doméstico (ou amigo do mesmo sexo) e acompanhada tanto do cônjuge quanto do animal (ou amigo).	Com a pessoa sozinha, acompanhada do marido ou da mulher, acompanhada do animal doméstico ou do amigo do mesmo sexo e acompanhada tanto do marido ou da mulher quanto do animal ou amigo.
138	ORI->STR	S	N	Os resultados, segundo Allen, mostraram que as pessoas com animais domésticos tinham tanto pressão sanguínea como batimento cardíaco "significativamente" mais baixos durante o período de descanso inicial.	Na opinião de Allen, os resultados mostraram que as pessoas com animais domésticos tinham pressão sanguínea e batidas do coração muito mais baixas durante o período de descanso inicial.
139	ORI->STR	S	N	"Isso não é um equipamento que vise aplicação comercial", afirmou.	"Isso não é um equipamento que vise à aplicação comercial".
139	ORI->STR	S	N	A energia faz com que a proteína fique carregada eletricamente (ionizada).	A energia faz a proteína ficar carregada de eletricidade.
139	ORI->STR	S	N	O bombardeamento da amostra é feito por partículas de califórnio (um elemento radioativo) em vez de laser.	Partículas de califórnio e não laser bombardeiam a porção de proteína.
141	ORI->STR	S	N	Segundo informou a ASI (agência espacial italiana) no fim da noite de ontem por telefone, o impacto dos destroços teria ocorrido às 18h06 (horário de Brasília), numa área remota do oceano.	A agência espacial italiana informou no fim da noite, por telefone, que o choque dos restos teria ocorrido às 18h06 de Brasília, numa área remota do oceano.
141	ORI->STR	S	N	Depois disso, o satélite deixou de ter sua órbita corrigida.	Em seguida, deixaram de corrigir a órbita do satélite.
142	ORI->STR	S	N	Um estudo defendendo a idéia foi publicado on-line pela revista científica norte-americano "Science" (www.sciencexpress.org).	A revista americana "Science" publicou on-line um estudo defendendo a idéia.
143	ORI->STR	S	N	Hoje há menos de 10 mil exemplares remanescentes.	Hoje, restam menos de 10 mil exemplares.
144	ORI->STR	S	N	Essa proposta, ainda segundo o ministro da Agricultura, será discutida pelo governo.	O ministro da Agricultura também disse que o governo discutirá essa proposta.
144	ORI->STR	S	N	"Um assunto produtivo não pode ser tratado pela polícia", afirmou.	"A polícia não pode tratar de um assunto de produção".
145	ORI->STR	S	N	Essa antiguidade pode significar que o causador da doença, também conhecida como Sars (sigla em inglês para síndrome respiratória aguda grave), não sofre mutações com tanta facilidade.	Por ser antigo, o vírus que causa a doença Sars não sofre mutações com tanta facilidade.
145	ORI->STR	S	N	Segundo Zanotto, o animal que se procura é muito provavelmente uma ave.	Zanotto diz que o animal é provavelmente uma ave.
145	ORI->STR	S	N	Ou seja, algum mecanismo genético que faça a partícula produzir cópias de si mesma sem muitas trocas de "letras" no RNA.	Ele precisa de algum mecanismo dos genes que faça a partícula produzir cópias de si mesma sem muitas trocas de "letras" no RNA.
146	ORI->STR	S	N	"Se há um animal de boa qualidade genética, a gente consegue manter isso em um filho [clonado] do animal, mesmo que esteja velho".	"Se há um animal com genes de boa qualidade, a gente consegue manter isso em um filho clonado do animal".
146	ORI->STR	S	N	Vitoriosa é o resultado de um experimento realizado pela Embrapa.	Vitoriosa é o resultado de uma experiência que a Embrapa realizou.
146	ORI->STR	S	N	Nesse experimento, foram produzidos 35 embriões em seguida transferidos para 17 receptoras, as chamadas mães de aluguel.	Essa experiência produziu 35 embriões em seguida transferidos para 17 vacas.
